{
  "schema_version": "1.0.0",
  "document_kind": "meshy_pricing",
  "pricing_id": "meshy_api_2026_08_31",
  "checked_at": "2026-08-31",
  "expires_at": "2026-09-30",
  "source_url": "https://docs.meshy.ai/api/pricing.md",
  "costs": {
    "image_to_3d": {
      "smart-topology": {
        "meshy-t2": {
          "untextured": 5
        }
      }
    },
    "multi_image_to_3d": {
      "standard": {
        "meshy-7": {
          "untextured": 20
        },
        "latest": {
          "untextured": 20
        }
      }
    }
  }
}
